[
  {"id":"event-1","label":"첫 만남","description":"도희가 민준과 업무 관계로 만난다.","order":1,"causes":[],"status":"OBSERVED","evidence":[{"sourceId":"src-fixture","fileName":"합성예제.md","chapter":"1장 첫 만남","paragraph":1,"paragraphHash":"04f3ec88cf0bb2729ae7828cf8d6a0151542d90cecafda40baa7510082c94a3c","excerpt":"도희는 아직 거리를 둔 채 민준을 선생님이라고 불렀다."}]}
]
